{
  "producer": "P3",
  "mock_status": "VERIFIED-REAL",
  "contract_version": "1.0",
  "generation_commit": "594c9a91df08a211ee1270de566c70d61205af26",
  "p_tamper": 0.9900758624030114,
  "shap_attributions": {
    "entropy": 0.09399726366601309,
    "pov_chi2": 0.18025828108159705,
    "lsb_kl": 1.5661725535395155,
    "ks_stat": 0.47082659122326864,
    "mean": 0.06827506211158825,
    "std": 0.6194561404617098,
    "skewness": 0.061278969552361326,
    "kurtosis": 0.6825895289346912,
    "sparsity": 0.5427432148081015,
    "outlier_pct": 0.21328989519563785
  },
  "model_version": "lightgbm-phase4-final"
}
